{
  "schema": "aps.work-order.v26.7.30",
  "id": "aps-v26.7.30-fortune5-safe-mcp-a2a",
  "release": "v26.7.30",
  "source": {
    "repository": "seanchatmangpt/agile-protocol-specification",
    "base": "dcd4b5bb6c7e11b12a6ff5e8fb73b1c8e613790f",
    "admitted_observations": [
      "MCP specification 2025-11-25 separates tools, resources, prompts, lifecycle, and client capabilities",
      "A2A 1.0.0 separates Agent Cards, Messages, Tasks, Parts, and Artifacts from internal agent implementation",
      "SAFe enterprise coordination distinguishes portfolios, value streams, Solution Trains, ARTs, teams, and cadence events",
      "APS requires exclusive receipted actuation and typed refusal"
    ]
  },
  "target": {
    "consequence": "A deterministic Rust simulation demonstrates MCP capability use, A2A peer delegation, bounded SAFe autonomics, receipts, and replay at Fortune-5 scale.",
    "state": "InReview"
  },
  "scope": {
    "included": [
      "fictional Fortune-5-scale SAFe topology",
      "Rust simulation engine",
      "MCP 2025-11-25 semantic profile",
      "A2A 1.0.0 semantic profile",
      "MAPE-K autonomic controllers",
      "exclusive actuation broker",
      "hash-chained receipts and deterministic replay",
      "positive and negative fixtures",
      "GitHub verification workflow",
      "normative mdBook chapter"
    ],
    "forbidden": [
      "claims about a real Fortune 5 company",
      "unreceipted state mutation",
      "autonomous lean-budget reallocation",
      "A2A agents directly mutating enterprise state",
      "implicit MCP or A2A full conformance claims",
      "SAFe certification or affiliation claims"
    ]
  },
  "authority": {
    "selector": "APS v26.7.30 work order",
    "implementer": "Rust simulation kernel and protocol adapters",
    "verifier": "GitHub Actions plus deterministic negative fixtures",
    "promoter": "human maintainer after receipt review"
  },
  "acceptance": [
    {
      "id": "format",
      "command": "cargo fmt --manifest-path simulation/fortune5-safe/Cargo.toml -- --check",
      "expected": "exit 0",
      "kind": "unit"
    },
    {
      "id": "clippy",
      "command": "cargo clippy --manifest-path simulation/fortune5-safe/Cargo.toml --all-targets -- -D warnings",
      "expected": "exit 0 with no warnings",
      "kind": "integration"
    },
    {
      "id": "tests",
      "command": "cargo test --manifest-path simulation/fortune5-safe/Cargo.toml --all-targets",
      "expected": "all protocol, broker, and replay tests pass",
      "kind": "integration"
    },
    {
      "id": "e2e-simulation",
      "command": "python3 simulation/fortune5-safe/scripts/verify.py --require-cargo",
      "expected": "ALIVE receipt with at least 800 teams and a valid 64-character receipt head",
      "kind": "e2e"
    },
    {
      "id": "deterministic-replay",
      "command": "cargo run --manifest-path simulation/fortune5-safe/Cargo.toml -- self-test --config simulation/fortune5-safe/config/fortune5-enterprise.json --scenario simulation/fortune5-safe/config/global-core-modernization.json",
      "expected": "same coordinate produces identical metrics, event count, receipt head, and replay key",
      "kind": "verifier-report"
    }
  ],
  "falsifiers": [
    {
      "id": "budget-authority",
      "same_object": true,
      "observation": "An autonomic controller reallocates lean budget without human investment authority.",
      "expected_refusal": "HUMAN_AUTHORIZATION_REQUIRED"
    },
    {
      "id": "unbounded-capacity",
      "same_object": true,
      "observation": "A capacity rebalance greater than five percent is applied.",
      "expected_refusal": "BOUNDED_DELTA_REFUSED"
    },
    {
      "id": "unreceipted-actuation",
      "same_object": true,
      "observation": "An enterprise metric changes through a control action without an actuation receipt.",
      "expected_refusal": "ZERO_UNRECEIPTED_ACTUATION_VIOLATED"
    },
    {
      "id": "replay-drift",
      "same_object": true,
      "observation": "Two runs with the same config, scenario, seed, and toolchain produce different receipt heads.",
      "expected_refusal": "DETERMINISTIC_REPLAY_MISMATCH"
    }
  ],
  "evidence": {
    "coordinate_fields": [
      "repository revision",
      "enterprise config digest",
      "scenario digest",
      "seed",
      "Rust toolchain",
      "protocol versions"
    ],
    "standing_ceiling": "ALIVE",
    "receipt_schema": "aps.safe-simulation-verifier.v26.7.30"
  },
  "gall": {
    "checkpoints": [
      {
        "id": "G1-static-admission",
        "claim": "Configuration, protocol profile, fixtures, and source invariants are present and parseable.",
        "predecessors": []
      },
      {
        "id": "G2-rust-compile",
        "claim": "The Rust crate formats, compiles, and passes clippy.",
        "predecessors": ["G1-static-admission"]
      },
      {
        "id": "G3-protocol-integration",
        "claim": "MCP and A2A fixtures exercise the shared engine and broker.",
        "predecessors": ["G2-rust-compile"]
      },
      {
        "id": "G4-autonomic-negative-controls",
        "claim": "Human authority and bounded-delta violations are refused with typed receipts.",
        "predecessors": ["G3-protocol-integration"]
      },
      {
        "id": "G5-enterprise-replay",
        "claim": "The Fortune-5-scale scenario executes twice with identical receipt heads.",
        "predecessors": ["G4-autonomic-negative-controls"]
      }
    ]
  },
  "rollback": {
    "rule": "Remove the simulation chapter, package, workflow, and work order without altering the APS constitutional chapters.",
    "preserve": [
      "v26.7.30 book source",
      "existing PDF build workflow",
      "work-order and receipt base schemas"
    ]
  },
  "exclusions": [
    "network server deployment",
    "OAuth and production identity integration",
    "full A2A streaming and push notification support",
    "full MCP sampling, elicitation, and task support",
    "vendor-specific portfolio tooling adapters",
    "real employee, customer, financial, or operational data"
  ],
  "nonclaims": [
    "The fictional scale profile does not describe any actual Fortune 5 company.",
    "The implementation is a bounded semantic profile rather than certification for MCP, A2A, or SAFe.",
    "ALIVE standing applies only to the recorded verifier ladder and exact source coordinate.",
    "The simulator does not prove that a real enterprise will achieve the simulated outcomes."
  ]
}
